{
  "schema_version": "1.0",
  "finding_id": "F001",
  "title": "Synthetic defect",
  "explanation": "Synthetic explanation",
  "file_path": "src/example.py",
  "severity": "medium",
  "defect_category": "correctness",
  "failure_mechanism": "Synthetic failure mechanism",
  "confidence": 0.75,
  "evidence": [{"source_type": "file", "reference": "src/example.py"}]
}
